{
  "id": "MIF-PPL-CORD-CARE-004",
  "class": "market_intelligence_record",
  "product_id": "PPL-CORD-CARE-001",
  "category": "unclaimed_angle",
  "statement": "No reviewed newborn cord-care product or guidance claims a family/elder-conflict-navigation or culturally-competent positioning (i.e., helping the mother adopt dry care without a family blow-up) as its offering.",
  "evidence": "Searches for cord-care products and parent-advice content surfaced clinical guidance pages and a few drying-spray/kits items, none positioned on navigating the grandmother/MIL/alcohol-era conflict surfaced in customer threads.",
  "evidence_status": "analyst_interpretation",
  "evidence_weight": "medium",
  "scan_coverage_note": "Scan coverage (Absence-Claim Safeguard): reviewed English-web results for newborn cord-care product categories and parent-advice articles (BabyCenter, Cloudnine, Merck, WHO ENC, the alcohol-vs-dry-care meta-analysis) and cord-care discussion on r/newborns and r/beyondthebump. NOT scanned: paid ad catalogs, non-English and offline community marketplaces (Nairaland was CAPTCHA-blocked), Facebook groups, and Nigeria/Ghana retail shelves. The absence claim is limited to the scanned English-web + English-community landscape.",
  "freshness": "2024-2026",
  "source": "Exa web/product searches + Reddit cord-care threads (this pass)",
  "provenance": "evidence_backed",
  "created_at": "2026-09-16T00:00:00.000Z",
  "is_fixture": false
}
